{"candidate_policy":{"agent_program_slots":2,"identity_slots":1,"proposal_guidance":"Supply only minimal effect-distinct candidates justified by public evidence.","schema_version":"candidate-policy/1","selection_guidance":"Choose one candidate explicitly and prefer identity when public evidence is insufficient.","total_k":3},"dependency_shas":{"agent_schema:agent_envelope_v1":"994d2bb075cd4baafef2f0eac645bf9091eb7259234310711a24d9aa6f807dc4","agent_schema:behavior_predicate_v1":"7ec81e447a80bba6999e8c61b1ad4a8894a0b68c249ceda3574795364a3d4543","agent_schema:fast_inspect_v1":"f6b320f281280307b89286be048bea94806571a9136d2e13bbede22ba91a2548","agent_schema:fast_propose_v1":"fc0475c4af312102ae1ae90f0b30495b614574adde33a5dc97d448eb60756d46","agent_schema:fast_select_v1":"aaac183f548ce165fa228d557cfe6a54d23889fc68ecf0b0046a705144f1b23e","agent_schema:slow_edit_v1":"1db5166cb717a183e4c39e017b43b74182d25a13c47df88726ff1dc11c90cdc3","agent_schema:tool_result_v1":"63bdffff8a0d583689d6e0a48332904cbddf37ac0835e0206a83b6a1b52aa570","candidate_contract":"b48f3842400071a28f69feaff7d73c1d39eff3843d4e9572a51d0007e6f61999","canonicalizer_source":"bdabde345fd17548579cdeef6840774ac03b78793b04541800310d717c9805c1","compiler_source":"90e74d02fe872c5b77b9253ef3bf97ae3e8321cab11da245a518612cd8d1f3bd","observable_contract":"08ff4dfa87d844ae11b4a287686e1de07b31c5b6e9cd4e5bf76fe75f0ffbf97a","operator_bundle":"bd0343974379f72a70a2e657ab3eb336ee63cfcdbc7b60aa7c39906ab36ef02a","operator_registry":"9292e97d921be7bab8e9c50ce4a03f1d4fe568dc4bca8decbacc8f5bca4b0854","public_boundary_contract":"0ac5e55f776ec98e5446ddcce644c834409a75221e8ffad4459d07b3f6451baf","runtime:agent_backend":"f0285a9f13ceb826f750c2f036f83efe13e663b9c7839716c92f3c6bceccc1b9","runtime:candidate_pool":"c7c3f8aa33d64a05e25cf4b835c51f408febca298ab2ccbb8361581033c8ef70","runtime:decision_trace":"7a096895e5acf467e8c58606045466ecda8fa74a278d73b4900371510d98d0df","runtime:executor":"4aecb406c43649f56b42ebe251bc863e5a4768ab33cc6fa3ea6c78ecb9e62fb6","runtime:llm_cache":"c25f1668af54c29d018258304493f712fd5fe802a0b7abcea5651c9a69e61b38","runtime:public_features":"66adbee2ab2cc78487fcf7025bdb0de79490443b0fdfb95276c42b08ddfbb435","schema:edit_manifest_v2":"a131ccf4cc43e95741b6d99ba69f860e7f67b2a74bcb2b00940da253934efd9c","schema:harness_snapshot_v1":"90b542c8ee78de8943ddf1d71046700e63be720c88b7418f9daf80d29c41c1f4","schema:memory_entry_v1":"b4c49c476c35de5c6238c88e1cca969e9f7ad1111cf94e5dacfef6b2f155fffd","schema:observable_feature_v1":"081bede2f8db1e4bc04f6105a2936e821014998bef89baf0a07846f7070cffc4","schema:skill_entry_v1":"6c04d92d51df743ca13e05b183a4ea26c1388e56a877dba833e14e57c63d39db","surface_registry":"7fb818d519a9e26978661d5373f458d65a8634e089307233f6fb88a95c9a9b62","ttha:agent_core":"41a36d412797da7c7ca9fcd665a24609c31ec9c8044ca84fd1135dc277df5c30","ttha:fast_agent":"dd2aa89b9c8b1c3301df2c67b4f2892aa0d58b5bdd20577646301965ac7d77eb","ttha:method":"e3a1c71b2e68f5e182711b2817c517681e516f55b62c84e2c4f0db08982ca052","ttha:public_tools":"f7708343a86cbac50ee684a7589029ced53262183d14b2f8e896d0dbd1a42cb7","ttha:retrieval":"b09e29891775143a6bd0739abfdc592453d11b0f7f48e552e624842de62e9fb6","ttha:schema_contracts":"1337cdd196639e023dee4b97c0c189647c145495fce7faf6a4e4d98a6dc9edee","ttha:slow_agent":"1105792a1a19de123427991c8454f1b6e092378a7d0f52c7289e40719600fa02"},"harness_content_sha":"8f3845b09322109c878892d88d79810d07d303841574b1df10b3b94e33fca35e","instruction":"You are the TTHA preparation Agent. Use only public observations, declared tools,\ncanonical operator contracts, retrieved Harness content, and the typed output schema.\nNever request or infer clean references, injection metadata, candidate utility, or\nprivate rankings. Inspect before proposing. Supply at most the configured number of\neffect-distinct PROGRAM candidates. Select exactly one candidate, including identity.\nKeep modifications local and abstain when public evidence does not justify a repair.\n","memories":[],"retrieval":{"bootstrap":"always","capability":{"kind":"rule_lexical","top_k":2},"resolved_memory_index":[],"resolved_skill_index":[{"revision":1,"skill_id":"build_contrastive_candidates","skill_kind":"bootstrap_procedure"},{"revision":1,"skill_id":"inspect_and_localize","skill_kind":"bootstrap_procedure"},{"revision":1,"skill_id":"level_shift_contrast_candidate","skill_kind":"capability"},{"revision":1,"skill_id":"select_or_identity_and_verify","skill_kind":"bootstrap_procedure"}],"schema_version":"retrieval/1"},"runtime_bundle_sha":"7035aef5d57499e21a58b0dc44124255fdfd833eb744815ba63c7befef44f709","schema_version":"harness-snapshot/1","skills":[{"allowed_tools":[],"body":"Construct at most two minimal, behavior-distinct typed PROGRAM candidates from currently allowed tools; retain runtime identity as the control.","observable_applicability":{"const":true},"revision":1,"risk_guards":{},"schema_version":"skill-entry/1","skill_id":"build_contrastive_candidates","skill_kind":"bootstrap_procedure"},{"allowed_tools":[],"body":"Inspect public missingness, robust local deviation, level continuity, and period-consistency evidence. Preserve disjoint narrow hypotheses when a high robust-z signal spans a broad low-density region instead of merging the whole span. Procedure marker: sparse_localization_subregions/v1.","observable_applicability":{"const":true},"revision":1,"risk_guards":{},"schema_version":"skill-entry/1","skill_id":"inspect_and_localize","skill_kind":"bootstrap_procedure"},{"allowed_tools":["repair_level_shift"],"body":"When public inspection shows a forecast task with no missingness, reliable unchanged period evidence, a localized medium level-excursion signal, low local robust-z peak, low estimated level offset, flat imputation/clipping probes, negative denoising probes, and flat level-correction probes, do not use global denoising, imputation, or clipping as repair candidates. Supply at most one behavior-distinct PROGRAM candidate as a narrow contrast to identity: repair_level_shift over only the estimated excursion region using the public estimated_region_start_fraction, estimated_region_end_fraction, and estimated_level_offset bindings. Keep identity as the control candidate. During selection, treat flat level-correction probe response as non-disqualifying structural evidence for this narrow local contrast, not as a reason to prefer identity, when verification confirms the program is effect-distinct, its modified fraction is within max_modified_fraction, and the effective view is unchanged outside the estimated region. Choose the supplied repair_level_shift program under those verified conditions; otherwise explicitly select identity. Record the inspected region, candidate identity, modified-fraction guard, outside-scope preservation check, and that flat level-correction probes were not used as a veto in this scoped structural case.","observable_applicability":{"all":[{"feature":"task_kind","op":"==","value":"forecast"},{"feature":"missing_fraction","op":"==","value":"zero"},{"feature":"longest_missing_run_fraction","op":"==","value":"zero"},{"feature":"period_evidence_status","op":"==","value":"OK"},{"feature":"period_repair_available","op":"==","value":false},{"feature":"period_change_score","op":"==","value":"zero"},{"feature":"period_reliability","op":"==","value":"high"},{"feature":"level_excursion_score","op":"==","value":"medium"},{"feature":"local_robust_z_peak","op":"==","value":"low"},{"feature":"estimated_level_offset","op":"==","value":"low"},{"feature":"imputation_probe_direction","op":"==","value":"flat"},{"feature":"clipping_probe_direction","op":"==","value":"flat"},{"feature":"level_probe_direction","op":"==","value":"flat"},{"feature":"denoising_probe_direction","op":"==","value":"negative"}]},"revision":1,"risk_guards":{"avoid_clipping_when_clipping_probe_flat":true,"avoid_global_denoising":true,"avoid_imputation_when_missing_fraction_zero":true,"max_modified_fraction":0.35,"preserve_outside_candidate_region":true,"retain_identity_control":true,"single_surface_only":true},"schema_version":"skill-entry/1","skill_id":"level_shift_contrast_candidate","skill_kind":"capability"},{"allowed_tools":[],"body":"Compare candidates using deployment-visible evidence and risk guards only; choose one ID explicitly and record verification actions and scope.","observable_applicability":{"const":true},"revision":1,"risk_guards":{},"schema_version":"skill-entry/1","skill_id":"select_or_identity_and_verify","skill_kind":"bootstrap_procedure"}],"verification":{"identity_unfilterable":true,"max_modified_fraction":0.35,"preserve_outside_candidate_region":true,"require_explicit_choice":true,"schema_version":"verification/1"}}
